Sheet: Steps
A2: 1 | B2: Sort on Actual Numbers (Col B)
A3: 2 | B3: Sort on Absolute numbers (Col C)
A4: 3 | B4: Drag the formula in Col D, E & F
A5: 4 | B5: Sort on Col F
A6: 5 | B6: Drag the formula in Col G

Sheet: Working Sheet
A1: NAME | B1: AMT | C1: ABS | D1: Count | E1: Counter | F1: Unique | G1: Delete
A2: O | B2: -1000 | C2: =ABS(RC[-1]) -> 1000 | D2: =COUNTIF(C[-1],RC[-1]) -> 5 | E2: =IF(AND(RC[-3]=R[-1]C[-3],RC[-1]>1),R[-1]C+1,1) -> 1 | F2: =RC[-1]&VLOOKUP(RC[-1],Master!C[-5]:C[-4],2,0)&'Working Sheet'!RC[-3] -> 1A1000 | G2: =IF((RC[-5]+R[1]C[-5])=0,"D","R") -> D
A3: N | B3: 1000 | C3: =ABS(RC[-1]) -> 1000 | D3: =COUNTIF(C[-1],RC[-1]) -> 5 | E3: 1 | F3: =RC[-1]&VLOOKUP(RC[-1],Master!C[-5]:C[-4],2,0)&'Working Sheet'!R[3]C[-3] -> 1A2000 | G3: =IF(OR((RC[-5]+R[-1]C[-5])=0,(RC[-5]+R[1]C[-5])=0),"D","R") -> D
A4: G | B4: -15000 | C4: =ABS(RC[-1]) -> 15000 | D4: =COUNTIF(C[-1],RC[-1]) -> 9 | E4: =IF(AND(RC[-3]=R[-1]C[-3],RC[-1]>1),R[-1]C+1,1) -> 1 | F4: =RC[-1]&VLOOKUP(RC[-1],Master!C[-5]:C[-4],2,0)&'Working Sheet'!R[9]C[-3] -> 1A50000 | G4: =IF(OR((RC[-5]+R[-1]C[-5])=0,(RC[-5]+R[1]C[-5])=0),"D","R") -> D
A5: F | B5: 15000 | C5: =ABS(RC[-1]) -> 15000 | D5: =COUNTIF(C[-1],RC[-1]) -> 9 | E5: =IF(AND(RC[-3]=R[-1]C[-3],RC[-1]>1),R[-1]C+1,1) -> 1 | F5: =RC[-1]&VLOOKUP(RC[-1],Master!C[-5]:C[-4],2,0)&'Working Sheet'!R[12]C[-3] -> 1A21000 | G5: =IF(OR((RC[-5]+R[-1]C[-5])=0,(RC[-5]+R[1]C[-5])=0),"D","R") -> D
A6: D | B6: 2000 | C6: =ABS(RC[-1]) -> 2000 | D6: =COUNTIF(C[-1],RC[-1]) -> 1 | E6: =IF(AND(RC[-3]=R[-1]C[-3],RC[-1]>1),R[-1]C+1,1) -> 1 | F6: =RC[-1]&VLOOKUP(RC[-1],Master!C[-5]:C[-4],2,0)&'Working Sheet'!R[1]C[-3] -> 1A20000 | G6: =IF(OR((RC[-5]+R[-1]C[-5])=0,(RC[-5]+R[1]C[-5])=0),"D","R") -> R
A7: E | B7: -20000 | C7: =ABS(RC[-1]) -> 20000 | D7: =COUNTIF(C[-1],RC[-1]) -> 1 | E7: =IF(AND(RC[-3]=R[-1]C[-3],RC[-1]>1),R[-1]C+1,1) -> 1 | F7: =RC[-1]&VLOOKUP(RC[-1],Master!C[-5]:C[-4],2,0)&'Working Sheet'!R[15]C[-3] -> 1A15000 | G7: =IF(OR((RC[-5]+R[-1]C[-5])=0,(RC[-5]+R[1]C[-5])=0),"D","R") -> R
A8: W | B8: -20000 | C8: 20500 | D8: =COUNTIF(C[-1],RC[-1]) -> 1 | E8: =IF(AND(RC[-3]=R[-1]C[-3],RC[-1]>1),R[-1]C+1,1) -> 1 | F8: =RC[-1]&VLOOKUP(RC[-1],Master!C[-5]:C[-4],2,0)&'Working Sheet'!R[15]C[-3] -> 1A15000 | G8: =IF(OR((RC[-5]+R[-1]C[-5])=0,(RC[-5]+R[1]C[-5])=0),"D","R") -> R
A9: M | B9: -21000 | C9: =ABS(RC[-1]) -> 21000 | D9: =COUNTIF(C[-1],RC[-1]) -> 3 | E9: =IF(AND(RC[-3]=R[-1]C[-3],RC[-1]>1),R[-1]C+1,1) -> 1 | F9: =RC[-1]&VLOOKUP(RC[-1],Master!C[-5]:C[-4],2,0)&'Working Sheet'!R[15]C[-3] -> 1A5000 | G9: =IF(OR((RC[-5]+R[-1]C[-5])=0,(RC[-5]+R[1]C[-5])=0),"D","R") -> D
A10: K | B10: 21000 | C10: =ABS(RC[-1]) -> 21000 | D10: =COUNTIF(C[-1],RC[-1]) -> 3 | E10: =IF(AND(RC[-3]=R[-1]C[-3],RC[-1]>1),R[-1]C+1,1) -> 1 | F10: =RC[-1]&VLOOKUP(RC[-1],Master!C[-5]:C[-4],2,0)&'Working Sheet'!R[15]C[-3] -> 1A1000 | G10: =IF(OR((RC[-5]+R[-1]C[-5])=0,(RC[-5]+R[1]C[-5])=0),"D","R") -> D
A11: B | B11: -5000 | C11: =ABS(RC[-1]) -> 5000 | D11: =COUNTIF(C[-1],RC[-1]) -> 5 | E11: =IF(AND(RC[-3]=R[-1]C[-3],RC[-1]>1),R[-1]C+1,1) -> 1 | F11: =RC[-1]&VLOOKUP(RC[-1],Master!C[-5]:C[-4],2,0)&'Working Sheet'!R[-3]C[-3] -> 1A20500 | G11: =IF(OR((RC[-5]+R[-1]C[-5])=0,(RC[-5]+R[1]C[-5])=0),"D","R") -> D
A12: V | B12: 5000 | C12: =ABS(RC[-1]) -> 5000 | D12: =COUNTIF(C[-1],RC[-1]) -> 5 | E12: =IF(AND(RC[-3]=R[-1]C[-3],RC[-1]>1),R[-1]C+1,1) -> 1 | F12: =RC[-1]&VLOOKUP(RC[-1],Master!C[-5]:C[-4],2,0)&'Working Sheet'!R[-2]C[-3] -> 1A21000 | G12: =IF(OR((RC[-5]+R[-1]C[-5])=0,(RC[-5]+R[1]C[-5])=0),"D","R") -> D
A13: C | B13: 50000 | C13: =ABS(RC[-1]) -> 50000 | D13: =COUNTIF(C[-1],RC[-1]) -> 2 | E13: =IF(AND(RC[-3]=R[-1]C[-3],RC[-1]>1),R[-1]C+1,1) -> 1 | F13: =RC[-1]&VLOOKUP(RC[-1],Master!C[-5]:C[-4],2,0)&'Working Sheet'!R[14]C[-3] -> 1A15000 | G13: =IF(OR((RC[-5]+R[-1]C[-5])=0,(RC[-5]+R[1]C[-5])=0),"D","R") -> R
A14: P | B14: -1000 | C14: =ABS(RC[-1]) -> 1000 | D14: =COUNTIF(C[-1],RC[-1]) -> 5 | E14: =IF(AND(RC[-3]=R[-1]C[-3],RC[-1]>1),R[-1]C+1,1) -> 1 | F14: =RC[-1]&VLOOKUP(RC[-1],Master!C[-5]:C[-4],2,0)&'Working Sheet'!R[-11]C[-3] -> 1A1000 | G14: =IF(OR((RC[-5]+R[-1]C[-5])=0,(RC[-5]+R[1]C[-5])=0),"D","R") -> R
A15: I | B15: -15000 | C15: =ABS(RC[-1]) -> 15000 | D15: =COUNTIF(C[-1],RC[-1]) -> 9 | E15: =IF(AND(RC[-3]=R[-1]C[-3],RC[-1]>1),R[-1]C+1,1) -> 1 | F15: =RC[-1]&VLOOKUP(RC[-1],Master!C[-5]:C[-4],2,0)&'Working Sheet'!R[-1]C[-3] -> 1A1000 | G15: =IF(OR((RC[-5]+R[-1]C[-5])=0,(RC[-5]+R[1]C[-5])=0),"D","R") -> D
A16: H | B16: 15000 | C16: =ABS(RC[-1]) -> 15000 | D16: =COUNTIF(C[-1],RC[-1]) -> 9 | E16: =IF(AND(RC[-3]=R[-1]C[-3],RC[-1]>1),R[-1]C+1,1) -> 1 | F16: =RC[-1]&VLOOKUP(RC[-1],Master!C[-5]:C[-4],2,0)&'Working Sheet'!R[2]C[-3] -> 1A5000 | G16: =IF(OR((RC[-5]+R[-1]C[-5])=0,(RC[-5]+R[1]C[-5])=0),"D","R") -> D
A17: L | B17: 21000 | C17: =ABS(RC[-1]) -> 21000 | D17: =COUNTIF(C[-1],RC[-1]) -> 3 | E17: =IF(AND(RC[-3]=R[-1]C[-3],RC[-1]>1),R[-1]C+1,1) -> 1 | F17: =RC[-1]&VLOOKUP(RC[-1],Master!C[-5]:C[-4],2,0)&'Working Sheet'!R[9]C[-3] -> 1A15000 | G17: =IF(OR((RC[-5]+R[-1]C[-5])=0,(RC[-5]+R[1]C[-5])=0),"D","R") -> R
A18: T | B18: -5000 | C18: =ABS(RC[-1]) -> 5000 | D18: =COUNTIF(C[-1],RC[-1]) -> 5 | E18: =IF(AND(RC[-3]=R[-1]C[-3],RC[-1]>1),R[-1]C+1,1) -> 1 | F18: =RC[-1]&VLOOKUP(RC[-1],Master!C[-5]:C[-4],2,0)&'Working Sheet'!R[-9]C[-3] -> 1A21000 | G18: =IF(OR((RC[-5]+R[-1]C[-5])=0,(RC[-5]+R[1]C[-5])=0),"D","R") -> D
A19: A | B19: 5000 | C19: =ABS(RC[-1]) -> 5000 | D19: =COUNTIF(C[-1],RC[-1]) -> 5 | E19: =IF(AND(RC[-3]=R[-1]C[-3],RC[-1]>1),R[-1]C+1,1) -> 1 | F19: =RC[-1]&VLOOKUP(RC[-1],Master!C[-5]:C[-4],2,0)&'Working Sheet'!R[-8]C[-3] -> 1A5000 | G19: =IF(OR((RC[-5]+R[-1]C[-5])=0,(RC[-5]+R[1]C[-5])=0),"D","R") -> D
A20: U | B20: 50000 | C20: =ABS(RC[-1]) -> 50000 | D20: =COUNTIF(C[-1],RC[-1]) -> 2 | E20: =IF(AND(RC[-3]=R[-1]C[-3],RC[-1]>1),R[-1]C+1,1) -> 1 | F20: =RC[-1]&VLOOKUP(RC[-1],Master!C[-5]:C[-4],2,0)&'Working Sheet'!R[8]C[-3] -> 1A15000 | G20: =IF(OR((RC[-5]+R[-1]C[-5])=0,(RC[-5]+R[1]C[-5])=0),"D","R") -> R
A21: X | B21: -1000 | C21: =ABS(RC[-1]) -> 1000 | D21: =COUNTIF(C[-1],RC[-1]) -> 5 | E21: =IF(AND(RC[-3]=R[-1]C[-3],RC[-1]>1),R[-1]C+1,1) -> 1 | F21: =RC[-1]&VLOOKUP(RC[-1],Master!C[-5]:C[-4],2,0)&'Working Sheet'!R[-17]C[-3] -> 1A15000 | G21: =IF(OR((RC[-5]+R[-1]C[-5])=0,(RC[-5]+R[1]C[-5])=0),"D","R") -> R
A22: R | B22: -15000 | C22: =ABS(RC[-1]) -> 15000 | D22: =COUNTIF(C[-1],RC[-1]) -> 9 | E22: =IF(AND(RC[-3]=R[-1]C[-3],RC[-1]>1),R[-1]C+1,1) -> 1 | F22: =RC[-1]&VLOOKUP(RC[-1],Master!C[-5]:C[-4],2,0)&'Working Sheet'!R[-7]C[-3] -> 1A15000 | G22: =IF(OR((RC[-5]+R[-1]C[-5])=0,(RC[-5]+R[1]C[-5])=0),"D","R") -> D
A23: J | B23: 15000 | C23: =ABS(RC[-1]) -> 15000 | D23: =COUNTIF(C[-1],RC[-1]) -> 9 | E23: =IF(AND(RC[-3]=R[-1]C[-3],RC[-1]>1),R[-1]C+1,1) -> 1 | F23: =RC[-1]&VLOOKUP(RC[-1],Master!C[-5]:C[-4],2,0)&'Working Sheet'!R[-4]C[-3] -> 1A5000 | G23: =IF(OR((RC[-5]+R[-1]C[-5])=0,(RC[-5]+R[1]C[-5])=0),"D","R") -> D
A24: S | B24: 5000 | C24: =ABS(RC[-1]) -> 5000 | D24: =COUNTIF(C[-1],RC[-1]) -> 5 | E24: =IF(AND(RC[-3]=R[-1]C[-3],RC[-1]>1),R[-1]C+1,1) -> 1 | F24: =RC[-1]&VLOOKUP(RC[-1],Master!C[-5]:C[-4],2,0)&'Working Sheet'!R[-12]C[-3] -> 1A5000 | G24: =IF(OR((RC[-5]+R[-1]C[-5])=0,(RC[-5]+R[1]C[-5])=0),"D","R") -> R
A25: Y | B25: -1000 | C25: =ABS(RC[-1]) -> 1000 | D25: =COUNTIF(C[-1],RC[-1]) -> 5 | E25: =IF(AND(RC[-3]=R[-1]C[-3],RC[-1]>1),R[-1]C+1,1) -> 1 | F25: =RC[-1]&VLOOKUP(RC[-1],Master!C[-5]:C[-4],2,0)&'Working Sheet'!R[-20]C[-3] -> 1A15000 | G25: =IF(OR((RC[-5]+R[-1]C[-5])=0,(RC[-5]+R[1]C[-5])=0),"D","R") -> R
A26: AA | B26: -15000 | C26: =ABS(RC[-1]) -> 15000 | D26: =COUNTIF(C[-1],RC[-1]) -> 9 | E26: =IF(AND(RC[-3]=R[-1]C[-3],RC[-1]>1),R[-1]C+1,1) -> 1 | F26: =RC[-1]&VLOOKUP(RC[-1],Master!C[-5]:C[-4],2,0)&'Working Sheet'!R[-10]C[-3] -> 1A15000 | G26: =IF(OR((RC[-5]+R[-1]C[-5])=0,(RC[-5]+R[1]C[-5])=0),"D","R") -> D
A27: Q | B27: 15000 | C27: =ABS(RC[-1]) -> 15000 | D27: =COUNTIF(C[-1],RC[-1]) -> 9 | E27: =IF(AND(RC[-3]=R[-1]C[-3],RC[-1]>1),R[-1]C+1,1) -> 1 | F27: =RC[-1]&VLOOKUP(RC[-1],Master!C[-5]:C[-4],2,0)&'Working Sheet'!R[-7]C[-3] -> 1A50000 | G27: =IF(OR((RC[-5]+R[-1]C[-5])=0,(RC[-5]+R[1]C[-5])=0),"D","R") -> D
A28: Z | B28: 15000 | C28: =ABS(RC[-1]) -> 15000 | D28: =COUNTIF(C[-1],RC[-1]) -> 9 | E28: =IF(AND(RC[-3]=R[-1]C[-3],RC[-1]>1),R[-1]C+1,1) -> 2 | F28: =RC[-1]&VLOOKUP(RC[-1],Master!C[-5]:C[-4],2,0)&'Working Sheet'!R[-7]C[-3] -> 2B1000 | G28: =IF(OR((RC[-5]+R[-1]C[-5])=0,(RC[-5]+R[1]C[-5])=0),"D","R") -> R

Sheet: Database
A1: NAME | B1: AMT
A2: A | B2: 5000
A3: B | B3: -5000
A4: C | B4: 50000
A5: D | B5: 2000
A6: E | B6: -20000
A7: F | B7: 15000
A8: G | B8: -15000
A9: H | B9: 15000
A10: I | B10: -15000
A11: J | B11: 15000
A12: K | B12: 21000
A13: L | B13: 21000
A14: M | B14: -21000
A15: N | B15: 1000
A16: O | B16: -1000
A17: P | B17: -1000
A18: Q | B18: 15000
A19: R | B19: -15000
A20: S | B20: 5000
A21: T | B21: -5000
A22: U | B22: 50000
A23: V | B23: 2000
A24: W | B24: -20000
A25: X | B25: -1000
A26: Y | B26: -1000
A27: Z | B27: 15000
A28: AA | B28: -15000

Sheet: Master
A1: No | B1: Key
A2: 1 | B2: A
A3: =R[-1]C+1 -> 2 | B3: B
A4: =R[-1]C+1 -> 3 | B4: C
A5: =R[-1]C+1 -> 4 | B5: D
A6: =R[-1]C+1 -> 5 | B6: E
A7: =R[-1]C+1 -> 6 | B7: F
A8: =R[-1]C+1 -> 7 | B8: G
A9: =R[-1]C+1 -> 8 | B9: H
A10: =R[-1]C+1 -> 9 | B10: I
A11: =R[-1]C+1 -> 10 | B11: J
A12: =R[-1]C+1 -> 11 | B12: K
A13: =R[-1]C+1 -> 12 | B13: L
A14: =R[-1]C+1 -> 13 | B14: M
A15: =R[-1]C+1 -> 14 | B15: N
A16: =R[-1]C+1 -> 15 | B16: O
A17: =R[-1]C+1 -> 16 | B17: P
A18: =R[-1]C+1 -> 17 | B18: Q
A19: =R[-1]C+1 -> 18 | B19: R
A20: =R[-1]C+1 -> 19 | B20: S
A21: =R[-1]C+1 -> 20 | B21: T
A22: =R[-1]C+1 -> 21 | B22: U
A23: =R[-1]C+1 -> 22 | B23: V
A24: =R[-1]C+1 -> 23 | B24: W
A25: =R[-1]C+1 -> 24 | B25: X
A26: =R[-1]C+1 -> 25 | B26: Y
A27: =R[-1]C+1 -> 26 | B27: Z
A28: =R[-1]C+1 -> 27 | B28: AA
A29: =R[-1]C+1 -> 28 | B29: AB
A30: =R[-1]C+1 -> 29 | B30: AC
A31: =R[-1]C+1 -> 30 | B31: AD
A32: =R[-1]C+1 -> 31 | B32: AE
A33: =R[-1]C+1 -> 32 | B33: AF
A34: =R[-1]C+1 -> 33 | B34: AG
A35: =R[-1]C+1 -> 34 | B35: AH
A36: =R[-1]C+1 -> 35 | B36: AI
A37: =R[-1]C+1 -> 36 | B37: AJ
A38: =R[-1]C+1 -> 37 | B38: AK
A39: =R[-1]C+1 -> 38 | B39: AL
A40: =R[-1]C+1 -> 39 | B40: AM
A41: =R[-1]C+1 -> 40 | B41: AN
A42: =R[-1]C+1 -> 41 | B42: AO
A43: =R[-1]C+1 -> 42 | B43: AP
A44: =R[-1]C+1 -> 43 | B44: AQ
A45: =R[-1]C+1 -> 44 | B45: AR
A46: =R[-1]C+1 -> 45 | B46: AS
A47: =R[-1]C+1 -> 46 | B47: AT
A48: =R[-1]C+1 -> 47 | B48: AU
A49: =R[-1]C+1 -> 48 | B49: AV
A50: =R[-1]C+1 -> 49 | B50: AW
A51: =R[-1]C+1 -> 50 | B51: AX
A52: =R[-1]C+1 -> 51 | B52: AY
A53: =R[-1]C+1 -> 52 | B53: AZ
A54: =R[-1]C+1 -> 53 | B54: AB
A55: =R[-1]C+1 -> 54 | B55: BB
A56: =R[-1]C+1 -> 55 | B56: CB
A57: =R[-1]C+1 -> 56 | B57: DB
A58: =R[-1]C+1 -> 57 | B58: EB
A59: =R[-1]C+1 -> 58 | B59: FB
A60: =R[-1]C+1 -> 59 | B60: GB
A61: =R[-1]C+1 -> 60 | B61: HB
A62: =R[-1]C+1 -> 61 | B62: IB
A63: =R[-1]C+1 -> 62 | B63: JB
A64: =R[-1]C+1 -> 63 | B64: KB
A65: =R[-1]C+1 -> 64 | B65: LB
A66: =R[-1]C+1 -> 65 | B66: MB
A67: =R[-1]C+1 -> 66 | B67: NB
A68: =R[-1]C+1 -> 67 | B68: OB
A69: =R[-1]C+1 -> 68 | B69: PB
A70: =R[-1]C+1 -> 69 | B70: QB
A71: =R[-1]C+1 -> 70 | B71: RB
A72: =R[-1]C+1 -> 71 | B72: SB
A73: =R[-1]C+1 -> 72 | B73: TB
A74: =R[-1]C+1 -> 73 | B74: UB
A75: =R[-1]C+1 -> 74 | B75: VB
A76: =R[-1]C+1 -> 75 | B76: WB
A77: =R[-1]C+1 -> 76 | B77: XB
A78: =R[-1]C+1 -> 77 | B78: YB
A79: =R[-1]C+1 -> 78 | B79: ZB
A80: =R[-1]C+1 -> 79 | B80: AC
A81: =R[-1]C+1 -> 80 | B81: BC
A82: =R[-1]C+1 -> 81 | B82: CC
A83: =R[-1]C+1 -> 82 | B83: DC
A84: =R[-1]C+1 -> 83 | B84: EC
A85: =R[-1]C+1 -> 84 | B85: FC
A86: =R[-1]C+1 -> 85 | B86: GC
A87: =R[-1]C+1 -> 86 | B87: HC
A88: =R[-1]C+1 -> 87 | B88: IC
A89: =R[-1]C+1 -> 88 | B89: JC
A90: =R[-1]C+1 -> 89 | B90: KC
A91: =R[-1]C+1 -> 90 | B91: LC
A92: =R[-1]C+1 -> 91 | B92: MC
A93: =R[-1]C+1 -> 92 | B93: NC
A94: =R[-1]C+1 -> 93 | B94: OC
A95: =R[-1]C+1 -> 94 | B95: PC
A96: =R[-1]C+1 -> 95 | B96: QC
A97: =R[-1]C+1 -> 96 | B97: RC
A98: =R[-1]C+1 -> 97 | B98: SC
A99: =R[-1]C+1 -> 98 | B99: TC
A100: =R[-1]C+1 -> 99 | B100: UC
A101: =R[-1]C+1 -> 100 | B101: VC
A102: =R[-1]C+1 -> 101 | B102: WC
A103: =R[-1]C+1 -> 102 | B103: XC
A104: =R[-1]C+1 -> 103 | B104: YC
A105: =R[-1]C+1 -> 104 | B105: ZC
A106: =R[-1]C+1 -> 105 | B106: AD
A107: =R[-1]C+1 -> 106 | B107: BD
A108: =R[-1]C+1 -> 107 | B108: CD
A109: =R[-1]C+1 -> 108 | B109: DD
A110: =R[-1]C+1 -> 109 | B110: ED
A111: =R[-1]C+1 -> 110 | B111: FD
A112: =R[-1]C+1 -> 111 | B112: GD
A113: =R[-1]C+1 -> 112 | B113: HD
A114: =R[-1]C+1 -> 113 | B114: ID
A115: =R[-1]C+1 -> 114 | B115: JD
A116: =R[-1]C+1 -> 115 | B116: KD
A117: =R[-1]C+1 -> 116 | B117: LD
A118: =R[-1]C+1 -> 117 | B118: MD
A119: =R[-1]C+1 -> 118 | B119: ND
A120: =R[-1]C+1 -> 119 | B120: OD
A121: =R[-1]C+1 -> 120 | B121: PD
A122: =R[-1]C+1 -> 121 | B122: QD
A123: =R[-1]C+1 -> 122 | B123: RD
A124: =R[-1]C+1 -> 123 | B124: SD
A125: =R[-1]C+1 -> 124 | B125: TD
A126: =R[-1]C+1 -> 125 | B126: UD
A127: =R[-1]C+1 -> 126 | B127: VD
A128: =R[-1]C+1 -> 127 | B128: WD
A129: =R[-1]C+1 -> 128 | B129: XD
A130: =R[-1]C+1 -> 129 | B130: YD
A131: =R[-1]C+1 -> 130 | B131: ZD
A132: =R[-1]C+1 -> 131 | B132: AE
A133: =R[-1]C+1 -> 132 | B133: BE
A134: =R[-1]C+1 -> 133 | B134: CE
A135: =R[-1]C+1 -> 134 | B135: DE
A136: =R[-1]C+1 -> 135 | B136: EE
A137: =R[-1]C+1 -> 136 | B137: FE
A138: =R[-1]C+1 -> 137 | B138: GE
A139: =R[-1]C+1 -> 138 | B139: HE
A140: =R[-1]C+1 -> 139 | B140: IE
A141: =R[-1]C+1 -> 140 | B141: JE
A142: =R[-1]C+1 -> 141 | B142: KE
A143: =R[-1]C+1 -> 142 | B143: LE
A144: =R[-1]C+1 -> 143 | B144: ME
A145: =R[-1]C+1 -> 144 | B145: NE
A146: =R[-1]C+1 -> 145 | B146: OE
A147: =R[-1]C+1 -> 146 | B147: PE
A148: =R[-1]C+1 -> 147 | B148: QE
A149: =R[-1]C+1 -> 148 | B149: RE
A150: =R[-1]C+1 -> 149 | B150: SE
A151: =R[-1]C+1 -> 150 | B151: TE
A152: =R[-1]C+1 -> 151 | B152: UE
A153: =R[-1]C+1 -> 152 | B153: VE
A154: =R[-1]C+1 -> 153 | B154: WE
A155: =R[-1]C+1 -> 154 | B155: XE
A156: =R[-1]C+1 -> 155 | B156: YE
A157: =R[-1]C+1 -> 156 | B157: ZE
A158: =R[-1]C+1 -> 157 | B158: AF
A159: =R[-1]C+1 -> 158 | B159: BF
A160: =R[-1]C+1 -> 159 | B160: CF
A161: =R[-1]C+1 -> 160 | B161: DF
A162: =R[-1]C+1 -> 161 | B162: EF
A163: =R[-1]C+1 -> 162 | B163: FF
A164: =R[-1]C+1 -> 163 | B164: GF
A165: =R[-1]C+1 -> 164 | B165: HF
A166: =R[-1]C+1 -> 165 | B166: IF
A167: =R[-1]C+1 -> 166 | B167: JF
A168: =R[-1]C+1 -> 167 | B168: KF
A169: =R[-1]C+1 -> 168 | B169: LF
A170: =R[-1]C+1 -> 169 | B170: MF
A171: =R[-1]C+1 -> 170 | B171: NF
A172: =R[-1]C+1 -> 171 | B172: OF
A173: =R[-1]C+1 -> 172 | B173: PF
A174: =R[-1]C+1 -> 173 | B174: QF
A175: =R[-1]C+1 -> 174 | B175: RF
A176: =R[-1]C+1 -> 175 | B176: SF
A177: =R[-1]C+1 -> 176 | B177: TF
A178: =R[-1]C+1 -> 177 | B178: UF
A179: =R[-1]C+1 -> 178 | B179: VF
A180: =R[-1]C+1 -> 179 | B180: WF
A181: =R[-1]C+1 -> 180 | B181: XF
A182: =R[-1]C+1 -> 181 | B182: YF
A183: =R[-1]C+1 -> 182 | B183: ZF
A184: =R[-1]C+1 -> 183 | B184: AG
A185: =R[-1]C+1 -> 184 | B185: BG
A186: =R[-1]C+1 -> 185 | B186: CG
A187: =R[-1]C+1 -> 186 | B187: DG
A188: =R[-1]C+1 -> 187 | B188: EG
A189: =R[-1]C+1 -> 188 | B189: FG
A190: =R[-1]C+1 -> 189 | B190: GG
A191: =R[-1]C+1 -> 190 | B191: HG
A192: =R[-1]C+1 -> 191 | B192: IG
A193: =R[-1]C+1 -> 192 | B193: JG
A194: =R[-1]C+1 -> 193 | B194: KG
A195: =R[-1]C+1 -> 194 | B195: LG
A196: =R[-1]C+1 -> 195 | B196: MG
A197: =R[-1]C+1 -> 196 | B197: NG
A198: =R[-1]C+1 -> 197 | B198: OG
A199: =R[-1]C+1 -> 198 | B199: PG
A200: =R[-1]C+1 -> 199 | B200: QG
A201: =R[-1]C+1 -> 200 | B201: RG
A202: =R[-1]C+1 -> 201 | B202: SG
A203: =R[-1]C+1 -> 202 | B203: TG
A204: =R[-1]C+1 -> 203 | B204: UG
A205: =R[-1]C+1 -> 204 | B205: VG
A206: =R[-1]C+1 -> 205 | B206: WG
A207: =R[-1]C+1 -> 206 | B207: XG
A208: =R[-1]C+1 -> 207 | B208: YG
A209: =R[-1]C+1 -> 208 | B209: ZG
A210: =R[-1]C+1 -> 209 | B210: AH
A211: =R[-1]C+1 -> 210 | B211: BH
A212: =R[-1]C+1 -> 211 | B212: CH
A213: =R[-1]C+1 -> 212 | B213: DH
A214: =R[-1]C+1 -> 213 | B214: EH
A215: =R[-1]C+1 -> 214 | B215: FH
A216: =R[-1]C+1 -> 215 | B216: GH
A217: =R[-1]C+1 -> 216 | B217: HH
A218: =R[-1]C+1 -> 217 | B218: IH
A219: =R[-1]C+1 -> 218 | B219: JH
A220: =R[-1]C+1 -> 219 | B220: KH
A221: =R[-1]C+1 -> 220 | B221: LH
A222: =R[-1]C+1 -> 221 | B222: MH
A223: =R[-1]C+1 -> 222 | B223: NH
A224: =R[-1]C+1 -> 223 | B224: OH
A225: =R[-1]C+1 -> 224 | B225: PH
A226: =R[-1]C+1 -> 225 | B226: QH
A227: =R[-1]C+1 -> 226 | B227: RH
A228: =R[-1]C+1 -> 227 | B228: SH
A229: =R[-1]C+1 -> 228 | B229: TH
A230: =R[-1]C+1 -> 229 | B230: UH
A231: =R[-1]C+1 -> 230 | B231: VH
A232: =R[-1]C+1 -> 231 | B232: WH
A233: =R[-1]C+1 -> 232 | B233: XH
A234: =R[-1]C+1 -> 233 | B234: YH
A235: =R[-1]C+1 -> 234 | B235: ZH
A236: =R[-1]C+1 -> 235 | B236: AI
A237: =R[-1]C+1 -> 236 | B237: BI
A238: =R[-1]C+1 -> 237 | B238: CI
A239: =R[-1]C+1 -> 238 | B239: DI
A240: =R[-1]C+1 -> 239 | B240: EI
A241: =R[-1]C+1 -> 240 | B241: FI
A242: =R[-1]C+1 -> 241 | B242: GI
A243: =R[-1]C+1 -> 242 | B243: HI
A244: =R[-1]C+1 -> 243 | B244: II
A245: =R[-1]C+1 -> 244 | B245: JI
A246: =R[-1]C+1 -> 245 | B246: KI
A247: =R[-1]C+1 -> 246 | B247: LI
A248: =R[-1]C+1 -> 247 | B248: MI
A249: =R[-1]C+1 -> 248 | B249: NI
A250: =R[-1]C+1 -> 249 | B250: OI
A251: =R[-1]C+1 -> 250 | B251: PI
A252: =R[-1]C+1 -> 251 | B252: QI
A253: =R[-1]C+1 -> 252 | B253: RI
A254: =R[-1]C+1 -> 253 | B254: SI
A255: =R[-1]C+1 -> 254 | B255: TI
A256: =R[-1]C+1 -> 255 | B256: UI
A257: =R[-1]C+1 -> 256 | B257: VI
A258: =R[-1]C+1 -> 257 | B258: WI
A259: =R[-1]C+1 -> 258 | B259: XI
A260: =R[-1]C+1 -> 259 | B260: YI
A261: =R[-1]C+1 -> 260 | B261: ZI
A262: =R[-1]C+1 -> 261 | B262: AJ
A263: =R[-1]C+1 -> 262 | B263: BJ
A264: =R[-1]C+1 -> 263 | B264: CJ
A265: =R[-1]C+1 -> 264 | B265: DJ
A266: =R[-1]C+1 -> 265 | B266: EJ
A267: =R[-1]C+1 -> 266 | B267: FJ
A268: =R[-1]C+1 -> 267 | B268: GJ
A269: =R[-1]C+1 -> 268 | B269: HJ
A270: =R[-1]C+1 -> 269 | B270: IJ
A271: =R[-1]C+1 -> 270 | B271: JJ
A272: =R[-1]C+1 -> 271 | B272: KJ
A273: =R[-1]C+1 -> 272 | B273: LJ
A274: =R[-1]C+1 -> 273 | B274: MJ
A275: =R[-1]C+1 -> 274 | B275: NJ
A276: =R[-1]C+1 -> 275 | B276: OJ
A277: =R[-1]C+1 -> 276 | B277: PJ
A278: =R[-1]C+1 -> 277 | B278: QJ
A279: =R[-1]C+1 -> 278 | B279: RJ
A280: =R[-1]C+1 -> 279 | B280: SJ
A281: =R[-1]C+1 -> 280 | B281: TJ
A282: =R[-1]C+1 -> 281 | B282: UJ
A283: =R[-1]C+1 -> 282 | B283: VJ
A284: =R[-1]C+1 -> 283 | B284: WJ
A285: =R[-1]C+1 -> 284 | B285: XJ
A286: =R[-1]C+1 -> 285 | B286: YJ
A287: =R[-1]C+1 -> 286 | B287: ZJ
A288: =R[-1]C+1 -> 287 | B288: AK
A289: =R[-1]C+1 -> 288 | B289: BK
A290: =R[-1]C+1 -> 289 | B290: CK
A291: =R[-1]C+1 -> 290 | B291: DK
A292: =R[-1]C+1 -> 291 | B292: EK
A293: =R[-1]C+1 -> 292 | B293: FK
A294: =R[-1]C+1 -> 293 | B294: GK
A295: =R[-1]C+1 -> 294 | B295: HK
A296: =R[-1]C+1 -> 295 | B296: IK
A297: =R[-1]C+1 -> 296 | B297: JK
A298: =R[-1]C+1 -> 297 | B298: KK
A299: =R[-1]C+1 -> 298 | B299: LK
A300: =R[-1]C+1 -> 299 | B300: MK
A301: =R[-1]C+1 -> 300 | B301: NK
A302: =R[-1]C+1 -> 301 | B302: OK
A303: =R[-1]C+1 -> 302 | B303: PK
A304: =R[-1]C+1 -> 303 | B304: QK
A305: =R[-1]C+1 -> 304 | B305: RK
A306: =R[-1]C+1 -> 305 | B306: SK
A307: =R[-1]C+1 -> 306 | B307: TK
A308: =R[-1]C+1 -> 307 | B308: UK
A309: =R[-1]C+1 -> 308 | B309: VK
A310: =R[-1]C+1 -> 309 | B310: WK
A311: =R[-1]C+1 -> 310 | B311: XK
A312: =R[-1]C+1 -> 311 | B312: YK
A313: =R[-1]C+1 -> 312 | B313: ZK
A314: =R[-1]C+1 -> 313 | B314: AL
A315: =R[-1]C+1 -> 314 | B315: BL
A316: =R[-1]C+1 -> 315 | B316: CL
A317: =R[-1]C+1 -> 316 | B317: DL
A318: =R[-1]C+1 -> 317 | B318: EL
A319: =R[-1]C+1 -> 318 | B319: FL
A320: =R[-1]C+1 -> 319 | B320: GL
A321: =R[-1]C+1 -> 320 | B321: HL
A322: =R[-1]C+1 -> 321 | B322: IL
A323: =R[-1]C+1 -> 322 | B323: JL
A324: =R[-1]C+1 -> 323 | B324: KL
A325: =R[-1]C+1 -> 324 | B325: LL
A326: =R[-1]C+1 -> 325 | B326: ML
A327: =R[-1]C+1 -> 326 | B327: NL
A328: =R[-1]C+1 -> 327 | B328: OL
A329: =R[-1]C+1 -> 328 | B329: PL
A330: =R[-1]C+1 -> 329 | B330: QL
A331: =R[-1]C+1 -> 330 | B331: RL
A332: =R[-1]C+1 -> 331 | B332: SL
A333: =R[-1]C+1 -> 332 | B333: TL
A334: =R[-1]C+1 -> 333 | B334: UL
A335: =R[-1]C+1 -> 334 | B335: VL
A336: =R[-1]C+1 -> 335 | B336: WL
A337: =R[-1]C+1 -> 336 | B337: XL
A338: =R[-1]C+1 -> 337 | B338: YL
A339: =R[-1]C+1 -> 338 | B339: ZL
A340: =R[-1]C+1 -> 339 | B340: AM
A341: =R[-1]C+1 -> 340 | B341: BM
A342: =R[-1]C+1 -> 341 | B342: CM
A343: =R[-1]C+1 -> 342 | B343: DM
A344: =R[-1]C+1 -> 343 | B344: EM
A345: =R[-1]C+1 -> 344 | B345: FM
A346: =R[-1]C+1 -> 345 | B346: GM
A347: =R[-1]C+1 -> 346 | B347: HM
A348: =R[-1]C+1 -> 347 | B348: IM
A349: =R[-1]C+1 -> 348 | B349: JM
A350: =R[-1]C+1 -> 349 | B350: KM
A351: =R[-1]C+1 -> 350 | B351: LM
A352: =R[-1]C+1 -> 351 | B352: MM
A353: =R[-1]C+1 -> 352 | B353: NM
A354: =R[-1]C+1 -> 353 | B354: OM
A355: =R[-1]C+1 -> 354 | B355: PM
A356: =R[-1]C+1 -> 355 | B356: QM
A357: =R[-1]C+1 -> 356 | B357: RM
A358: =R[-1]C+1 -> 357 | B358: SM
A359: =R[-1]C+1 -> 358 | B359: TM
A360: =R[-1]C+1 -> 359 | B360: UM
A361: =R[-1]C+1 -> 360 | B361: VM
A362: =R[-1]C+1 -> 361 | B362: WM
A363: =R[-1]C+1 -> 362 | B363: XM
A364: =R[-1]C+1 -> 363 | B364: YM
A365: =R[-1]C+1 -> 364 | B365: ZM
A366: =R[-1]C+1 -> 365 | B366: AN
A367: =R[-1]C+1 -> 366 | B367: BN
A368: =R[-1]C+1 -> 367 | B368: CN
A369: =R[-1]C+1 -> 368 | B369: DN
A370: =R[-1]C+1 -> 369 | B370: EN
A371: =R[-1]C+1 -> 370 | B371: FN
A372: =R[-1]C+1 -> 371 | B372: GN
A373: =R[-1]C+1 -> 372 | B373: HN
A374: =R[-1]C+1 -> 373 | B374: IN
A375: =R[-1]C+1 -> 374 | B375: JN
A376: =R[-1]C+1 -> 375 | B376: KN
A377: =R[-1]C+1 -> 376 | B377: LN
A378: =R[-1]C+1 -> 377 | B378: MN
A379: =R[-1]C+1 -> 378 | B379: NN
A380: =R[-1]C+1 -> 379 | B380: ON
A381: =R[-1]C+1 -> 380 | B381: PN
A382: =R[-1]C+1 -> 381 | B382: QN
A383: =R[-1]C+1 -> 382 | B383: RN
A384: =R[-1]C+1 -> 383 | B384: SN
A385: =R[-1]C+1 -> 384 | B385: TN
A386: =R[-1]C+1 -> 385 | B386: UN
A387: =R[-1]C+1 -> 386 | B387: VN
A388: =R[-1]C+1 -> 387 | B388: WN
A389: =R[-1]C+1 -> 388 | B389: XN
A390: =R[-1]C+1 -> 389 | B390: YN
A391: =R[-1]C+1 -> 390 | B391: ZN
A392: =R[-1]C+1 -> 391 | B392: AO
A393: =R[-1]C+1 -> 392 | B393: BO
A394: =R[-1]C+1 -> 393 | B394: CO
A395: =R[-1]C+1 -> 394 | B395: DO
A396: =R[-1]C+1 -> 395 | B396: EO
A397: =R[-1]C+1 -> 396 | B397: FO
A398: =R[-1]C+1 -> 397 | B398: GO
A399: =R[-1]C+1 -> 398 | B399: HO
A400: =R[-1]C+1 -> 399 | B400: IO
A401: =R[-1]C+1 -> 400 | B401: JO
A402: =R[-1]C+1 -> 401 | B402: KO
A403: =R[-1]C+1 -> 402 | B403: LO
A404: =R[-1]C+1 -> 403 | B404: MO
A405: =R[-1]C+1 -> 404 | B405: NO
A406: =R[-1]C+1 -> 405 | B406: OO
A407: =R[-1]C+1 -> 406 | B407: PO
A408: =R[-1]C+1 -> 407 | B408: QO
A409: =R[-1]C+1 -> 408 | B409: RO
A410: =R[-1]C+1 -> 409 | B410: SO
A411: =R[-1]C+1 -> 410 | B411: TO
A412: =R[-1]C+1 -> 411 | B412: UO
A413: =R[-1]C+1 -> 412 | B413: VO
A414: =R[-1]C+1 -> 413 | B414: WO
A415: =R[-1]C+1 -> 414 | B415: XO
A416: =R[-1]C+1 -> 415 | B416: YO
A417: =R[-1]C+1 -> 416 | B417: ZO
A418: =R[-1]C+1 -> 417 | B418: AP
A419: =R[-1]C+1 -> 418 | B419: BP
A420: =R[-1]C+1 -> 419 | B420: CP
A421: =R[-1]C+1 -> 420 | B421: DP
A422: =R[-1]C+1 -> 421 | B422: EP
A423: =R[-1]C+1 -> 422 | B423: FP
A424: =R[-1]C+1 -> 423 | B424: GP
A425: =R[-1]C+1 -> 424 | B425: HP
A426: =R[-1]C+1 -> 425 | B426: IP
A427: =R[-1]C+1 -> 426 | B427: JP
A428: =R[-1]C+1 -> 427 | B428: KP
A429: =R[-1]C+1 -> 428 | B429: LP
A430: =R[-1]C+1 -> 429 | B430: MP
A431: =R[-1]C+1 -> 430 | B431: NP
A432: =R[-1]C+1 -> 431 | B432: OP
A433: =R[-1]C+1 -> 432 | B433: PP
A434: =R[-1]C+1 -> 433 | B434: QP
A435: =R[-1]C+1 -> 434 | B435: RP
A436: =R[-1]C+1 -> 435 | B436: SP
A437: =R[-1]C+1 -> 436 | B437: TP
A438: =R[-1]C+1 -> 437 | B438: UP
A439: =R[-1]C+1 -> 438 | B439: VP
A440: =R[-1]C+1 -> 439 | B440: WP
A441: =R[-1]C+1 -> 440 | B441: XP
A442: =R[-1]C+1 -> 441 | B442: YP
A443: =R[-1]C+1 -> 442 | B443: ZP
A444: =R[-1]C+1 -> 443 | B444: AQ
A445: =R[-1]C+1 -> 444 | B445: BQ
A446: =R[-1]C+1 -> 445 | B446: CQ
A447: =R[-1]C+1 -> 446 | B447: DQ
A448: =R[-1]C+1 -> 447 | B448: EQ
A449: =R[-1]C+1 -> 448 | B449: FQ
A450: =R[-1]C+1 -> 449 | B450: GQ
A451: =R[-1]C+1 -> 450 | B451: HQ
A452: =R[-1]C+1 -> 451 | B452: IQ
A453: =R[-1]C+1 -> 452 | B453: JQ
A454: =R[-1]C+1 -> 453 | B454: KQ
A455: =R[-1]C+1 -> 454 | B455: LQ
A456: =R[-1]C+1 -> 455 | B456: MQ
A457: =R[-1]C+1 -> 456 | B457: NQ
A458: =R[-1]C+1 -> 457 | B458: OQ
A459: =R[-1]C+1 -> 458 | B459: PQ
A460: =R[-1]C+1 -> 459 | B460: QQ
A461: =R[-1]C+1 -> 460 | B461: RQ
A462: =R[-1]C+1 -> 461 | B462: SQ
A463: =R[-1]C+1 -> 462 | B463: TQ
A464: =R[-1]C+1 -> 463 | B464: UQ
A465: =R[-1]C+1 -> 464 | B465: VQ
A466: =R[-1]C+1 -> 465 | B466: WQ
A467: =R[-1]C+1 -> 466 | B467: XQ
A468: =R[-1]C+1 -> 467 | B468: YQ
A469: =R[-1]C+1 -> 468 | B469: ZQ
A470: =R[-1]C+1 -> 469 | B470: AR
A471: =R[-1]C+1 -> 470 | B471: BR
A472: =R[-1]C+1 -> 471 | B472: CR
A473: =R[-1]C+1 -> 472 | B473: DR
A474: =R[-1]C+1 -> 473 | B474: ER
A475: =R[-1]C+1 -> 474 | B475: FR
A476: =R[-1]C+1 -> 475 | B476: GR
A477: =R[-1]C+1 -> 476 | B477: HR
A478: =R[-1]C+1 -> 477 | B478: IR
A479: =R[-1]C+1 -> 478 | B479: JR
A480: =R[-1]C+1 -> 479 | B480: KR
A481: =R[-1]C+1 -> 480 | B481: LR
A482: =R[-1]C+1 -> 481 | B482: MR
A483: =R[-1]C+1 -> 482 | B483: NR
A484: =R[-1]C+1 -> 483 | B484: OR
A485: =R[-1]C+1 -> 484 | B485: PR
A486: =R[-1]C+1 -> 485 | B486: QR
A487: =R[-1]C+1 -> 486 | B487: RR
A488: =R[-1]C+1 -> 487 | B488: SR
A489: =R[-1]C+1 -> 488 | B489: TR
A490: =R[-1]C+1 -> 489 | B490: UR
A491: =R[-1]C+1 -> 490 | B491: VR
A492: =R[-1]C+1 -> 491 | B492: WR
A493: =R[-1]C+1 -> 492 | B493: XR
A494: =R[-1]C+1 -> 493 | B494: YR
A495: =R[-1]C+1 -> 494 | B495: ZR
A496: =R[-1]C+1 -> 495 | B496: AS
A497: =R[-1]C+1 -> 496 | B497: BS
A498: =R[-1]C+1 -> 497 | B498: CS
A499: =R[-1]C+1 -> 498 | B499: DS
A500: =R[-1]C+1 -> 499 | B500: ES
A501: =R[-1]C+1 -> 500 | B501: FS
A502: =R[-1]C+1 -> 501 | B502: GS
A503: =R[-1]C+1 -> 502 | B503: HS
A504: =R[-1]C+1 -> 503 | B504: IS
A505: =R[-1]C+1 -> 504 | B505: JS
A506: =R[-1]C+1 -> 505 | B506: KS
A507: =R[-1]C+1 -> 506 | B507: LS
A508: =R[-1]C+1 -> 507 | B508: MS
A509: =R[-1]C+1 -> 508 | B509: NS
A510: =R[-1]C+1 -> 509 | B510: OS
A511: =R[-1]C+1 -> 510 | B511: PS
A512: =R[-1]C+1 -> 511 | B512: QS
A513: =R[-1]C+1 -> 512 | B513: RS
A514: =R[-1]C+1 -> 513 | B514: SS
A515: =R[-1]C+1 -> 514 | B515: TS
A516: =R[-1]C+1 -> 515 | B516: US
A517: =R[-1]C+1 -> 516 | B517: VS
A518: =R[-1]C+1 -> 517 | B518: WS
A519: =R[-1]C+1 -> 518 | B519: XS
A520: =R[-1]C+1 -> 519 | B520: YS
A521: =R[-1]C+1 -> 520 | B521: ZS
A522: =R[-1]C+1 -> 521 | B522: AT
A523: =R[-1]C+1 -> 522 | B523: BT
A524: =R[-1]C+1 -> 523 | B524: CT
A525: =R[-1]C+1 -> 524 | B525: DT
A526: =R[-1]C+1 -> 525 | B526: ET
A527: =R[-1]C+1 -> 526 | B527: FT
A528: =R[-1]C+1 -> 527 | B528: GT
A529: =R[-1]C+1 -> 528 | B529: HT
A530: =R[-1]C+1 -> 529 | B530: IT
A531: =R[-1]C+1 -> 530 | B531: JT
A532: =R[-1]C+1 -> 531 | B532: KT
A533: =R[-1]C+1 -> 532 | B533: LT
A534: =R[-1]C+1 -> 533 | B534: MT
A535: =R[-1]C+1 -> 534 | B535: NT
A536: =R[-1]C+1 -> 535 | B536: OT
A537: =R[-1]C+1 -> 536 | B537: PT
A538: =R[-1]C+1 -> 537 | B538: QT
A539: =R[-1]C+1 -> 538 | B539: RT
A540: =R[-1]C+1 -> 539 | B540: ST
A541: =R[-1]C+1 -> 540 | B541: TT
A542: =R[-1]C+1 -> 541 | B542: UT
A543: =R[-1]C+1 -> 542 | B543: VT
A544: =R[-1]C+1 -> 543 | B544: WT
A545: =R[-1]C+1 -> 544 | B545: XT
A546: =R[-1]C+1 -> 545 | B546: YT
A547: =R[-1]C+1 -> 546 | B547: ZT
A548: =R[-1]C+1 -> 547 | B548: AU
A549: =R[-1]C+1 -> 548 | B549: BU
A550: =R[-1]C+1 -> 549 | B550: CU
A551: =R[-1]C+1 -> 550 | B551: DU
A552: =R[-1]C+1 -> 551 | B552: EU
A553: =R[-1]C+1 -> 552 | B553: FU
A554: =R[-1]C+1 -> 553 | B554: GU
A555: =R[-1]C+1 -> 554 | B555: HU
A556: =R[-1]C+1 -> 555 | B556: IU
A557: =R[-1]C+1 -> 556 | B557: JU
A558: =R[-1]C+1 -> 557 | B558: KU
A559: =R[-1]C+1 -> 558 | B559: LU
A560: =R[-1]C+1 -> 559 | B560: MU
A561: =R[-1]C+1 -> 560 | B561: NU
A562: =R[-1]C+1 -> 561 | B562: OU
A563: =R[-1]C+1 -> 562 | B563: PU
A564: =R[-1]C+1 -> 563 | B564: QU
A565: =R[-1]C+1 -> 564 | B565: RU
A566: =R[-1]C+1 -> 565 | B566: SU
A567: =R[-1]C+1 -> 566 | B567: TU
A568: =R[-1]C+1 -> 567 | B568: UU
A569: =R[-1]C+1 -> 568 | B569: VU
A570: =R[-1]C+1 -> 569 | B570: WU
A571: =R[-1]C+1 -> 570 | B571: XU
A572: =R[-1]C+1 -> 571 | B572: YU
A573: =R[-1]C+1 -> 572 | B573: ZU
A574: =R[-1]C+1 -> 573 | B574: AV
A575: =R[-1]C+1 -> 574 | B575: BV
A576: =R[-1]C+1 -> 575 | B576: CV
A577: =R[-1]C+1 -> 576 | B577: DV
A578: =R[-1]C+1 -> 577 | B578: EV
A579: =R[-1]C+1 -> 578 | B579: FV
A580: =R[-1]C+1 -> 579 | B580: GV
A581: =R[-1]C+1 -> 580 | B581: HV
A582: =R[-1]C+1 -> 581 | B582: IV
A583: =R[-1]C+1 -> 582 | B583: JV
A584: =R[-1]C+1 -> 583 | B584: KV
A585: =R[-1]C+1 -> 584 | B585: LV
A586: =R[-1]C+1 -> 585 | B586: MV
A587: =R[-1]C+1 -> 586 | B587: NV
A588: =R[-1]C+1 -> 587 | B588: OV
A589: =R[-1]C+1 -> 588 | B589: PV
A590: =R[-1]C+1 -> 589 | B590: QV
A591: =R[-1]C+1 -> 590 | B591: RV
A592: =R[-1]C+1 -> 591 | B592: SV
A593: =R[-1]C+1 -> 592 | B593: TV
A594: =R[-1]C+1 -> 593 | B594: UV
A595: =R[-1]C+1 -> 594 | B595: VV
A596: =R[-1]C+1 -> 595 | B596: WV
A597: =R[-1]C+1 -> 596 | B597: XV
A598: =R[-1]C+1 -> 597 | B598: YV
A599: =R[-1]C+1 -> 598 | B599: ZV
A600: =R[-1]C+1 -> 599 | B600: AW
A601: =R[-1]C+1 -> 600 | B601: BW
A602: =R[-1]C+1 -> 601 | B602: CW
A603: =R[-1]C+1 -> 602 | B603: DW
A604: =R[-1]C+1 -> 603 | B604: EW
A605: =R[-1]C+1 -> 604 | B605: FW
A606: =R[-1]C+1 -> 605 | B606: GW
A607: =R[-1]C+1 -> 606 | B607: HW
A608: =R[-1]C+1 -> 607 | B608: IW
A609: =R[-1]C+1 -> 608 | B609: JW
A610: =R[-1]C+1 -> 609 | B610: KW
A611: =R[-1]C+1 -> 610 | B611: LW
A612: =R[-1]C+1 -> 611 | B612: MW
A613: =R[-1]C+1 -> 612 | B613: NW
A614: =R[-1]C+1 -> 613 | B614: OW
A615: =R[-1]C+1 -> 614 | B615: PW
A616: =R[-1]C+1 -> 615 | B616: QW
A617: =R[-1]C+1 -> 616 | B617: RW
A618: =R[-1]C+1 -> 617 | B618: SW
A619: =R[-1]C+1 -> 618 | B619: TW
A620: =R[-1]C+1 -> 619 | B620: UW
A621: =R[-1]C+1 -> 620 | B621: VW
A622: =R[-1]C+1 -> 621 | B622: WW
A623: =R[-1]C+1 -> 622 | B623: XW
A624: =R[-1]C+1 -> 623 | B624: YW
A625: =R[-1]C+1 -> 624 | B625: ZW
A626: =R[-1]C+1 -> 625 | B626: AX
A627: =R[-1]C+1 -> 626 | B627: BX
A628: =R[-1]C+1 -> 627 | B628: CX
A629: =R[-1]C+1 -> 628 | B629: DX
A630: =R[-1]C+1 -> 629 | B630: EX
A631: =R[-1]C+1 -> 630 | B631: FX
A632: =R[-1]C+1 -> 631 | B632: GX
A633: =R[-1]C+1 -> 632 | B633: HX
A634: =R[-1]C+1 -> 633 | B634: IX
A635: =R[-1]C+1 -> 634 | B635: JX
A636: =R[-1]C+1 -> 635 | B636: KX
A637: =R[-1]C+1 -> 636 | B637: LX
A638: =R[-1]C+1 -> 637 | B638: MX
A639: =R[-1]C+1 -> 638 | B639: NX
A640: =R[-1]C+1 -> 639 | B640: OX
A641: =R[-1]C+1 -> 640 | B641: PX
A642: =R[-1]C+1 -> 641 | B642: QX
A643: =R[-1]C+1 -> 642 | B643: RX
A644: =R[-1]C+1 -> 643 | B644: SX
A645: =R[-1]C+1 -> 644 | B645: TX
A646: =R[-1]C+1 -> 645 | B646: UX
A647: =R[-1]C+1 -> 646 | B647: VX
A648: =R[-1]C+1 -> 647 | B648: WX
A649: =R[-1]C+1 -> 648 | B649: XX
A650: =R[-1]C+1 -> 649 | B650: YX
A651: =R[-1]C+1 -> 650 | B651: ZX
A652: =R[-1]C+1 -> 651 | B652: AY
A653: =R[-1]C+1 -> 652 | B653: BY
A654: =R[-1]C+1 -> 653 | B654: CY
A655: =R[-1]C+1 -> 654 | B655: DY
A656: =R[-1]C+1 -> 655 | B656: EY
A657: =R[-1]C+1 -> 656 | B657: FY
A658: =R[-1]C+1 -> 657 | B658: GY
A659: =R[-1]C+1 -> 658 | B659: HY
A660: =R[-1]C+1 -> 659 | B660: IY
A661: =R[-1]C+1 -> 660 | B661: JY
A662: =R[-1]C+1 -> 661 | B662: KY
A663: =R[-1]C+1 -> 662 | B663: LY
A664: =R[-1]C+1 -> 663 | B664: MY
A665: =R[-1]C+1 -> 664 | B665: NY
A666: =R[-1]C+1 -> 665 | B666: OY
A667: =R[-1]C+1 -> 666 | B667: PY
A668: =R[-1]C+1 -> 667 | B668: QY
A669: =R[-1]C+1 -> 668 | B669: RY
A670: =R[-1]C+1 -> 669 | B670: SY
A671: =R[-1]C+1 -> 670 | B671: TY
A672: =R[-1]C+1 -> 671 | B672: UY
A673: =R[-1]C+1 -> 672 | B673: VY
A674: =R[-1]C+1 -> 673 | B674: WY
A675: =R[-1]C+1 -> 674 | B675: XY
A676: =R[-1]C+1 -> 675 | B676: YY
A677: =R[-1]C+1 -> 676 | B677: ZY
A678: =R[-1]C+1 -> 677 | B678: AZ
A679: =R[-1]C+1 -> 678 | B679: BZ
A680: =R[-1]C+1 -> 679 | B680: CZ
A681: =R[-1]C+1 -> 680 | B681: DZ
A682: =R[-1]C+1 -> 681 | B682: EZ
A683: =R[-1]C+1 -> 682 | B683: FZ
A684: =R[-1]C+1 -> 683 | B684: GZ
A685: =R[-1]C+1 -> 684 | B685: HZ
A686: =R[-1]C+1 -> 685 | B686: IZ
A687: =R[-1]C+1 -> 686 | B687: JZ
A688: =R[-1]C+1 -> 687 | B688: KZ
A689: =R[-1]C+1 -> 688 | B689: LZ
A690: =R[-1]C+1 -> 689 | B690: MZ
A691: =R[-1]C+1 -> 690 | B691: NZ
A692: =R[-1]C+1 -> 691 | B692: OZ
A693: =R[-1]C+1 -> 692 | B693: PZ
A694: =R[-1]C+1 -> 693 | B694: QZ
A695: =R[-1]C+1 -> 694 | B695: RZ
A696: =R[-1]C+1 -> 695 | B696: SZ
A697: =R[-1]C+1 -> 696 | B697: TZ
A698: =R[-1]C+1 -> 697 | B698: UZ
A699: =R[-1]C+1 -> 698 | B699: VZ
A700: =R[-1]C+1 -> 699 | B700: WZ
A701: =R[-1]C+1 -> 700 | B701: XZ
A702: =R[-1]C+1 -> 701 | B702: YZ
A703: =R[-1]C+1 -> 702 | B703: ZZ